<?xml version="1.0" encoding="UTF-8"?>
<!-- Input XML document. This XML is valid against input.xsd XML schema -->

<st3:Device xmlns:xsi="http://www.w3.org/2001/XMLSchema-instance"
	xmlns:st3="http://nure.ua/emelianov/SummaryTask3/entity"
	xsi:schemaLocation="http://nure.ua/emelianov/SummaryTask3/entity input.xsd">

	<Part critical="true">
		<Name>Device 1</Name>
		<Origin>Japan</Origin>
		<Price>200</Price>
		<Type>
			<Peripheral>false</Peripheral>
			<EnergyConsumption>500</EnergyConsumption>
			<CoolerAvailability>true</CoolerAvailability>
			<Group>Input</Group>
			<Ports>
				<COM>true</COM>
				<USB>true</USB>
				<LPT>true</LPT>
			</Ports>
		</Type>
	</Part>

	<Part critical="false">
		<Name>Device 2</Name>
		<Origin>China</Origin>
		<Price>100</Price>
		<Type>
			<Peripheral>true</Peripheral>
			<EnergyConsumption>300</EnergyConsumption>
			<CoolerAvailability>false</CoolerAvailability>
			<Group>Output</Group>
			<Ports>
				<COM>false</COM>
				<USB>true</USB>
				<LPT>false</LPT>
			</Ports>
		</Type>
	</Part>

	<Part critical="true">
		<Name>Device 3</Name>
		<Origin>Germany</Origin>
		<Price>300</Price>
		<Type>
			<Peripheral>false</Peripheral>
			<EnergyConsumption>400</EnergyConsumption>
			<CoolerAvailability>true</CoolerAvailability>
			<Group>Multimedia</Group>
			<Ports>
				<COM>true</COM>
				<USB>false</USB>
				<LPT>true</LPT>
			</Ports>
		</Type>
	</Part>
	
		<Part critical="false">
		<Name>Device 4</Name>
		<Origin>Italy</Origin>
		<Price>400</Price>
		<Type>
			<Peripheral>true</Peripheral>
			<EnergyConsumption>200</EnergyConsumption>
			<CoolerAvailability>false</CoolerAvailability>
			<Group>Input</Group>
			<Ports>
				<COM>false</COM>
				<USB>false</USB>
				<LPT>true</LPT>
			</Ports>
		</Type>
	</Part>

</st3:Device>